[
  {
    "finding_id": "fda-drug-safety::broken-link::7415e355b41cccda",
    "fingerprint": "fda-drug-safety::broken-link::7415e355b41cccda",
    "job": "link-source-monitor",
    "source_id": "fda-drug-safety",
    "source_name": "FDA Drug Safety Communications",
    "source_url": "https://www.fda.gov/drugs/drug-safety-and-availability/drug-safety-communications",
    "source_type": "html",
    "detected_at": "2026-09-22T12:34:01+00:00",
    "change_type": "broken-link",
    "severity": "P1",
    "summary": "FDA Drug Safety Communications citation issue (broken-link) \u2014 https://www.fda.gov/drugs/drug-safety-and-availability/drug-safety-communications",
    "evidence": {
      "http_status": 404
    },
    "affects": [
      "03_Core_Topics/Geriatric/geriatric_psychiatry_inpatient_teaching.md",
      "03_Core_Topics/Impulse_Control/impulse_control_conduct_inpatient_teaching.md",
      "03_Core_Topics/Mood/mood_disorders_inpatient_teaching.md",
      "03_Core_Topics/Neurocognitive/neurocognitive_disorders_inpatient_teaching.md",
      "03_Core_Topics/Neurodevelopmental/neurodevelopmental_disorders_inpatient_teaching.md",
      "03_Core_Topics/Perinatal/perinatal_psychiatry_inpatient_teaching.md",
      "03_Core_Topics/Psychosis/psychotic_disorders_inpatient_teaching.md",
      "03_Core_Topics/SUD_Withdrawal/substance_use_inpatient_teaching.md",
      "04_Acute_and_Safety/Delirium/delirium_inpatient_teaching.md",
      "05_Psychopharmacology/ECT_Neuromodulation/ect_neuromodulation_inpatient_teaching.md",
      "05_Psychopharmacology/Protocol_Library/protocol_library_inpatient.md",
      "05_Psychopharmacology/Student_Primer_Top10/psychopharmacology_primer_inpatient.md",
      "07_Evidence_and_Reading/Inpatient_Evidence/evidence_inpatient.md",
      "07_Evidence_and_Reading/Landmark_Trials/INCORPORATION_PLAN.md",
      "07_Evidence_and_Reading/Landmark_Trials/reading_order_by_week.md",
      "07_Evidence_and_Reading/Rounds_Questions/rounds_questions.md",
      "13_Faculty_Resources/Handoffs/MASTER_attestation_ledger_2026-07-01.md",
      "13_Faculty_Resources/Handoffs/STATUS_LATEST.md",
      "13_Faculty_Resources/Handoffs/Tier3_attestation_sheet_2026-07-01.md",
      "13_Faculty_Resources/Handoffs/codex_qbank_spec_2026-06-29.md",
      "13_Faculty_Resources/Handoffs/library_review_2026-07-01.md",
      "13_Faculty_Resources/Handoffs/openevidence_library_accuracy_review_2026-06-30.md",
      "13_Faculty_Resources/Handoffs/openevidence_library_accuracy_review_2026-07-01.md",
      "14_Tracks/Resident/adv_psychopharmacology.md",
      "14_Tracks/Resident/canon_200.md"
    ],
    "recommended_action": "Authoritative source URL for `fda-drug-safety` is http 404. Update the canonical citation `url` in evidence_registry.json (and any citing pages), then re-run. This source feeds guideline surveillance \u2014 fixing it restores monitoring. (HTTP 404 from a source marked browser_required \u2014 some official sites serve a bot-block as a definitive 4xx; capped to P1. Verify from a non-runner network before acting: `python3 bin/verify_findings_offrunner.py`.)",
    "status": "triaged",
    "severity_cap": "P1"
  },
  {
    "finding_id": "clozapine-rems::broken-link::f48ddedaa541bacf",
    "fingerprint": "clozapine-rems::broken-link::f48ddedaa541bacf",
    "job": "link-source-monitor",
    "source_id": "clozapine-rems",
    "source_name": "FDA Clozapine Safety / REMS Removed",
    "source_url": "https://www.fda.gov/drugs/drug-safety-communications/fda-removes-risk-evaluation-and-mitigation-strategy-rems-program-antipsychotic-drug-clozapine",
    "source_type": "html",
    "detected_at": "2026-09-22T12:34:05+00:00",
    "change_type": "broken-link",
    "severity": "P1",
    "summary": "FDA Clozapine Safety / REMS Removed citation issue (broken-link) \u2014 https://www.fda.gov/drugs/drug-safety-communications/fda-removes-risk-evaluation-and-mitigation-strategy-rems-program-antipsychotic-drug-clozapine",
    "evidence": {
      "http_status": 404
    },
    "affects": [
      "01_Six_Week_Curriculum/Week_5_Acute_Emergency/README.md",
      "03_Core_Topics/Nutrition/nutrition_metabolic_inpatient_teaching.md",
      "03_Core_Topics/Psychosis/psychotic_disorders_inpatient_teaching.md",
      "03_Core_Topics/SUD_Withdrawal/substance_use_inpatient_teaching.md",
      "05_Psychopharmacology/ECT_Neuromodulation/ect_neuromodulation_inpatient_teaching.md",
      "05_Psychopharmacology/Protocol_Library/README.md",
      "05_Psychopharmacology/Protocol_Library/protocol_library_inpatient.md",
      "05_Psychopharmacology/README.md",
      "05_Psychopharmacology/Student_Primer_Top10/psychopharmacology_primer_inpatient.md",
      "07_Evidence_and_Reading/Inpatient_Evidence/evidence_inpatient.md",
      "07_Evidence_and_Reading/Landmark_Trials/INCORPORATION_PLAN.md",
      "07_Evidence_and_Reading/Landmark_Trials/LM_crosswalk.md",
      "07_Evidence_and_Reading/Landmark_Trials/landmark_trials_page.md",
      "07_Evidence_and_Reading/Landmark_Trials/reading_order_by_week.md",
      "07_Evidence_and_Reading/Rounds_Questions/rounds_questions.md",
      "12_Media/psychiatry_psychotherapy_podcast_library.md",
      "13_Faculty_Resources/Handoffs/HANDOFF_for_fable5_2026-07-01.md",
      "13_Faculty_Resources/Handoffs/MASTER_attestation_ledger_2026-07-01.md",
      "13_Faculty_Resources/Handoffs/STATUS_LATEST.md",
      "13_Faculty_Resources/Handoffs/codex_qbank_spec_2026-06-29.md",
      "13_Faculty_Resources/Handoffs/library_review_2026-07-01.md",
      "13_Faculty_Resources/Handoffs/openevidence_library_accuracy_review_2026-06-30.md",
      "13_Faculty_Resources/Handoffs/openevidence_library_accuracy_review_2026-07-01.md",
      "14_Tracks/MS3/Student_Ready_Pack/03_weekly_map/week_by_week_reading_map.md",
      "14_Tracks/MS3/Student_Ready_Pack/09_revision_maps/revision_plan.md",
      "14_Tracks/Resident/adv_psychopharmacology.md",
      "14_Tracks/Resident/canon_200.md",
      "14_Tracks/Resident/resident_welcome.md",
      "14_Tracks/Sub-I_MS4/README.md"
    ],
    "recommended_action": "Authoritative source URL for `clozapine-rems` is http 404. Update the canonical citation `url` in evidence_registry.json (and any citing pages), then re-run. This source feeds guideline surveillance \u2014 fixing it restores monitoring.",
    "status": "triaged"
  }
]